{
  "id": "intel-xpu",
  "display_name": "Intel GPU",
  "vendor": "intel",
  "accelerator_keys": ["xpu", "intel_gpu"],
  "benchmark_profile": "intel-xpu",
  "upstream_variant": "xpu",
  "upstream_vendor": "intel",
  "request_model": "dra",
  "device_classes": ["gpu.intel.com"],
  "resource_prefixes": ["gpu.intel.com/"],
  "monitor_resource_suffixes": ["monitoring"],
  "node_label_selector": { "intel.feature.node.kubernetes.io/gpu": "true" },
  "dranet_device_class": "dranet-rdma",
  "access_modes": ["dra", "plugin"],
  "driver": {
    "installer": "kustomize",
    "nfd_manifest_refs": [
      "https://github.com/intel/intel-device-plugins-for-kubernetes/deployments/nfd?ref=v0.36.0",
      "https://github.com/intel/intel-device-plugins-for-kubernetes/deployments/nfd/overlays/node-feature-rules?ref=v0.36.0"
    ],
    "modes": {
      "dra": {
        "manifest_ref": "https://github.com/intel/intel-resource-drivers-for-kubernetes/deployments/gpu?ref=gpu-v0.11.0",
        "min_kubernetes_version": "1.34.0",
        "daemonset_matchers": [
          { "name_contains": "intel-gpu-resource-driver" },
          { "namespace": "intel-gpu-resource-driver" },
          { "label": "app.kubernetes.io/name=intel-gpu-resource-driver" }
        ]
      },
      "plugin": {
        "manifest_ref": "https://github.com/intel/intel-device-plugins-for-kubernetes/deployments/gpu_plugin/overlays/nfd_labeled_nodes?ref=v0.36.0",
        "daemonset_matchers": [
          { "name_contains": "intel-gpu-plugin" },
          { "label": "app=intel-gpu-plugin" }
        ],
        "monitoring_flag": "-enable-monitoring"
      }
    }
  },
  "presence": {
    "node_label_selector": { "intel.feature.node.kubernetes.io/gpu": "true" },
    "ensure_refs": [
      "https://github.com/intel/intel-device-plugins-for-kubernetes/deployments/nfd?ref=v0.36.0",
      "https://github.com/intel/intel-device-plugins-for-kubernetes/deployments/nfd/overlays/node-feature-rules?ref=v0.36.0"
    ],
    "timeout_seconds": 90,
    "poll_interval_seconds": 5
  },
  "telemetry": {
    "provider_id": "intel_gpu",
    "device_metrics": {
      "utilization": "hw_gpu_utilization_ratio{hw_gpu_task=\"compute-all\"}",
      "framebuffer_used": "hw_memory_usage_bytes{hw_memory_location=\"device\"}",
      "vram": "hw_memory_size_bytes",
      "memory_read_throughput": "hw_memory_read_throughput_bytes",
      "memory_write_throughput": "hw_memory_write_throughput_bytes",
      "memory_bandwidth_utilization": "hw_memory_bandwidth_utilization_ratio"
    },
    "device_metric_sources": {
      "utilization": { "metric": "hw_gpu_utilization_ratio", "unit": "ratio", "scale": 100, "match": { "hw_gpu_task": "compute-all" } },
      "framebuffer_used": { "metric": "hw_memory_usage_bytes", "unit": "bytes", "match": { "hw_memory_location": "device" } },
      "vram": { "metric": "hw_memory_size_bytes", "unit": "bytes" },
      "memory_read_throughput": { "metric": "hw_memory_read_throughput_bytes", "unit": "bytes" },
      "memory_write_throughput": { "metric": "hw_memory_write_throughput_bytes", "unit": "bytes" },
      "memory_bandwidth_utilization": { "metric": "hw_memory_bandwidth_utilization_ratio", "unit": "ratio", "scale": 100 },
      "memory_utilization": { "metric": "hw_memory_utilization_ratio", "unit": "ratio" },
      "power": { "metric": "hw_power_watts", "unit": "watt" },
      "temperature": { "metric": "hw_temperature_celsius", "unit": "celsius" }
    },
    "label_schema": {
      "node": "node",
      "pci": "pci_bdf",
      "device": "com_intel_subdevice_id"
    },
    "allocation_join": "dra",
    "pod_metrics": {},
    "scrape_path": "/api/v1/namespaces/intel-xpumd/services/http:xpumd:8080/proxy/metrics"
  },
  "deployment": {
    "overlay_root": "guides/{guide}/modelserver/{variant}/vllm",
    "arch": "xpu",
    "device_class": "gpu.intel.com",
    "claim_request_name": "intel",
    "node_selector": { "intel.feature.node.kubernetes.io/gpu": "true" },
    "resource_name": null,
    "supports_pci_allowlist": true,
    "runtime_image": "ghcr.io/llm-d/llm-d-xpu:v0.9.0"
  },
  "evaluation_profile": "intel-xpu",
  "planning": {
    "aic_system_patterns": ["bmg|max_|xpu|b60|pvc"],
    "default_backend": "vllm",
    "device_class_allow_pattern": "^gpu\\.intel\\.com$"
  },
  "ui": {
    "icon": "Cpu",
    "labels": { "vendor": "Intel", "metric_group": "XPU" }
  }
}
